{
  "id": "m06_seelig_message",
  "letterbox": true,
  "skippable": true,
  "location": {
    "system": "pentonville",
    "nav": "119CE Jump"
  },
  "outcome": {
    "player_at_nav": "119CE Jump",
    "spawns": [
      {
        "class": "talon",
        "faction": "pirate",
        "count": 1,
        "hostile": true,
        "cleared_flag": "killed:seelig"
      }
    ]
  },
  "timeline": [
    {
      "cmd": "spawn",
      "actor": "grayson_ship",
      "class": "$player",
      "faction": "civilian",
      "pos": [
        133333.0,
        -61667.0,
        81333.0
      ],
      "t": 0.0
    },
    {
      "cmd": "spawn",
      "actor": "seelig_ship",
      "class": "talon",
      "faction": "pirate",
      "pos": [
        133333.0,
        -61200.0,
        85000.0
      ],
      "t": 0.0
    },
    {
      "cmd": "fade_in",
      "dur": 1.2,
      "t": 0.0
    },
    {
      "cmd": "music",
      "file": "../music/original/combat_05.wav",
      "t": 0.0
    },
    {
      "cmd": "sfx",
      "file": "../sfx/engine_hum.wav",
      "t": 0.0
    },
    {
      "cmd": "camera_path",
      "dur": 3.5,
      "ease": "linear",
      "keys": [
        {
          "pos": [
            0.0,
            850.0,
            -2100.0
          ],
          "look_at": "ship:seelig_ship"
        }
      ],
      "t": 0.0,
      "follow": "seelig_ship"
    },
    {
      "cmd": "camera_path",
      "dur": 5.389999999999991,
      "ease": "linear",
      "keys": [
        {
          "pos": [
            270.0,
            95.0,
            -125.0
          ],
          "look_at": "ship:seelig_ship"
        }
      ],
      "t": 3.5,
      "follow": "seelig_ship"
    },
    {
      "cmd": "line",
      "speaker": "Captain Seelig",
      "text": "Burrows. Roman said you'd be carrying a message. Let's hear it.",
      "side": "right",
      "dur": 5.389999999999991,
      "portrait": "portraits/seelig/m06_seelig_message_01.png",
      "voice_file": "audio/m06_seelig_message_seelig_01.mp3",
      "t": 3.5
    },
    {
      "cmd": "camera_path",
      "dur": 10.969999999999928,
      "ease": "linear",
      "keys": [
        {
          "pos": [
            -255.0,
            90.0,
            -130.0
          ],
          "look_at": "ship:grayson_ship"
        }
      ],
      "t": 9.13999999999999,
      "follow": "grayson_ship"
    },
    {
      "cmd": "line",
      "speaker": "Grayson Burrows",
      "text": "Roman Lynch says: ‘I am profoundly disappointed in you.’ That's the whole message. He really knows how to make a man feel valued.",
      "side": "left",
      "dur": 10.969999999999928,
      "portrait": "portraits/grayson/m06_seelig_message_01.png",
      "voice_file": "audio/m06_seelig_message_grayson_01.mp3",
      "t": 9.13999999999999
    },
    {
      "cmd": "camera_path",
      "dur": 9.529999999999944,
      "ease": "linear",
      "keys": [
        {
          "pos": [
            -275.0,
            105.0,
            120.0
          ],
          "look_at": "ship:seelig_ship"
        }
      ],
      "t": 20.359999999999918,
      "follow": "seelig_ship"
    },
    {
      "cmd": "line",
      "speaker": "Captain Seelig",
      "text": "Profoundly disappointed. After ten years. You can carry my reply.",
      "side": "right",
      "dur": 9.529999999999944,
      "portrait": "portraits/seelig/m06_seelig_message_02.png",
      "voice_file": "audio/m06_seelig_message_seelig_02.mp3",
      "t": 20.359999999999918
    },
    {
      "cmd": "sfx",
      "file": "../sfx/lock_seeking.wav",
      "t": 29.889999999999862
    },
    {
      "cmd": "camera_path",
      "dur": 3.0,
      "ease": "linear",
      "keys": [
        {
          "pos": [
            0.0,
            650.0,
            -1800.0
          ],
          "look_at": "ship:seelig_ship"
        }
      ],
      "t": 30.139999999999862,
      "follow": "seelig_ship"
    },
    {
      "cmd": "sfx",
      "file": "../sfx/laser_fire.wav",
      "pos": [
        133333.0,
        -61200.0,
        85000.0
      ],
      "t": 30.33999999999986
    },
    {
      "cmd": "sfx",
      "file": "../sfx/laser_fire.wav",
      "pos": [
        133333.0,
        -61200.0,
        85000.0
      ],
      "t": 30.78999999999986
    },
    {
      "cmd": "sfx",
      "file": "../sfx/impact_shield.wav",
      "pos": [
        133333.0,
        -61667.0,
        81333.0
      ],
      "t": 31.189999999999863
    },
    {
      "cmd": "camera_path",
      "dur": 8.95399999999995,
      "ease": "linear",
      "keys": [
        {
          "pos": [
            250.0,
            85.0,
            135.0
          ],
          "look_at": "ship:grayson_ship"
        }
      ],
      "t": 33.13999999999986,
      "follow": "grayson_ship"
    },
    {
      "cmd": "line",
      "speaker": "Grayson Burrows",
      "text": "Some people take performance reviews way too personally. Oh well... guess I'm gonna have to blast one more idiot...",
      "side": "left",
      "dur": 8.95399999999995,
      "portrait": "portraits/grayson/m06_seelig_message_02.png",
      "voice_file": "audio/m06_seelig_message_grayson_02.mp3",
      "t": 33.13999999999986
    },
    {
      "cmd": "fade_out",
      "dur": 1.2,
      "t": 42.34399999999981
    },
    {
      "cmd": "end",
      "actions": [
        "set_flag:m06_seelig_message_seen",
        "set_flag:m06_message_delivered"
      ],
      "t": 43.54399999999981
    }
  ]
}
