{
  "id": "m04_customs_intercept",
  "letterbox": true,
  "skippable": true,
  "location": {
    "system": "new_constantinople",
    "nav": "44-P-1M Jump"
  },
  "outcome": {
    "player_at_nav": "44-P-1M Jump",
    "spawns": [
      {
        "class": "paradigm",
        "faction": "confed",
        "count": 1,
        "hostile": true
      },
      {
        "class": "broadsword",
        "faction": "confed",
        "count": 3,
        "hostile": true
      }
    ]
  },
  "timeline": [
    {
      "cmd": "spawn",
      "actor": "grayson_ship",
      "class": "$player",
      "faction": "civilian",
      "pos": [
        -66667.0,
        33333.0,
        64667.0
      ],
      "t": 0.0
    },
    {
      "cmd": "spawn",
      "actor": "paradigm_lead",
      "class": "paradigm",
      "faction": "confed",
      "pos": [
        -66667.0,
        37000.0,
        77000.0
      ],
      "t": 0.0
    },
    {
      "cmd": "spawn",
      "actor": "broadsword_port",
      "class": "broadsword",
      "faction": "confed",
      "pos": [
        -80667.0,
        31000.0,
        72000.0
      ],
      "t": 0.0
    },
    {
      "cmd": "spawn",
      "actor": "broadsword_center",
      "class": "broadsword",
      "faction": "confed",
      "pos": [
        -66667.0,
        25000.0,
        71500.0
      ],
      "t": 0.0
    },
    {
      "cmd": "spawn",
      "actor": "broadsword_starboard",
      "class": "broadsword",
      "faction": "confed",
      "pos": [
        -52667.0,
        31000.0,
        72000.0
      ],
      "t": 0.0
    },
    {
      "cmd": "fade_in",
      "dur": 1.2,
      "t": 0.0
    },
    {
      "cmd": "music",
      "file": "../music/original/combat_06.wav",
      "t": 0.0
    },
    {
      "cmd": "sfx",
      "file": "../sfx/engine_hum.wav",
      "t": 0.0
    },
    {
      "cmd": "camera_path",
      "dur": 4.0,
      "ease": "linear",
      "keys": [
        {
          "pos": [
            0.0,
            13000.0,
            -30000.0
          ],
          "look_at": "ship:paradigm_lead"
        }
      ],
      "t": 0.0,
      "follow": "paradigm_lead,broadsword_port,broadsword_center,broadsword_starboard"
    },
    {
      "cmd": "camera_path",
      "dur": 8.306,
      "ease": "linear",
      "keys": [
        {
          "pos": [
            1250.0,
            500.0,
            -700.0
          ],
          "look_at": "ship:paradigm_lead"
        }
      ],
      "t": 4.0,
      "follow": "paradigm_lead"
    },
    {
      "cmd": "line",
      "speaker": "Commander Elian Rourke",
      "text": "Unidentified privateer, cut thrust and prepare to be searched. This is a full-spectrum customs inspection.",
      "side": "right",
      "dur": 8.306,
      "portrait": "portraits/rourke/m04_customs_intercept_01.png",
      "voice_file": "audio/m04_customs_intercept_rourke_01.mp3",
      "t": 4.0
    },
    {
      "cmd": "camera_path",
      "dur": 6.614,
      "ease": "linear",
      "keys": [
        {
          "pos": [
            255.0,
            90.0,
            -125.0
          ],
          "look_at": "ship:grayson_ship"
        }
      ],
      "t": 12.556,
      "follow": "grayson_ship"
    },
    {
      "cmd": "line",
      "speaker": "Grayson Burrows",
      "text": "A full fleet for one cargo hold? I'm flattered. Tayla said the route was clear.",
      "side": "left",
      "dur": 6.614,
      "portrait": "portraits/grayson/m04_customs_intercept_01.png",
      "voice_file": "audio/m04_customs_intercept_grayson_01.mp3",
      "t": 12.556
    },
    {
      "cmd": "sfx",
      "file": "../sfx/lock_seeking.wav",
      "t": 19.17
    },
    {
      "cmd": "camera_path",
      "dur": 7.262,
      "ease": "linear",
      "keys": [
        {
          "pos": [
            -1250.0,
            430.0,
            -760.0
          ],
          "look_at": "ship:paradigm_lead"
        }
      ],
      "t": 19.42,
      "follow": "paradigm_lead"
    },
    {
      "cmd": "line",
      "speaker": "Commander Elian Rourke",
      "text": "Your hold contains twenty-five units of Brilliance. Bribery has a shelf life, Mr. Burrows.",
      "side": "right",
      "dur": 7.262,
      "portrait": "portraits/rourke/m04_customs_intercept_02.png",
      "voice_file": "audio/m04_customs_intercept_rourke_02.mp3",
      "t": 19.42
    },
    {
      "cmd": "camera_path",
      "dur": 5.678,
      "ease": "linear",
      "keys": [
        {
          "pos": [
            -250.0,
            105.0,
            -135.0
          ],
          "look_at": "ship:grayson_ship"
        }
      ],
      "t": 26.932,
      "follow": "grayson_ship"
    },
    {
      "cmd": "line",
      "speaker": "Grayson Burrows",
      "text": "Don't you guys have Kilrathi to shoot at? No wonder we're losing the war...",
      "side": "left",
      "dur": 5.678,
      "portrait": "portraits/grayson/m04_customs_intercept_02.png",
      "voice_file": "audio/m04_customs_intercept_grayson_02.mp3",
      "t": 26.932
    },
    {
      "cmd": "camera_path",
      "dur": 6.578,
      "ease": "linear",
      "keys": [
        {
          "pos": [
            1150.0,
            520.0,
            820.0
          ],
          "look_at": "ship:paradigm_lead"
        }
      ],
      "t": 32.86,
      "follow": "paradigm_lead"
    },
    {
      "cmd": "line",
      "speaker": "Commander Elian Rourke",
      "text": "We do. They complain less. All units, mark the smuggler hostile and open fire.",
      "side": "right",
      "dur": 6.578,
      "portrait": "portraits/rourke/m04_customs_intercept_03.png",
      "voice_file": "audio/m04_customs_intercept_rourke_03.mp3",
      "t": 32.86
    },
    {
      "cmd": "camera_path",
      "dur": 4.382,
      "ease": "linear",
      "keys": [
        {
          "pos": [
            245.0,
            80.0,
            145.0
          ],
          "look_at": "ship:grayson_ship"
        }
      ],
      "t": 39.688,
      "follow": "grayson_ship"
    },
    {
      "cmd": "line",
      "speaker": "Grayson Burrows",
      "text": "There it is—the famous Confed sense of proportion.",
      "side": "left",
      "dur": 4.382,
      "portrait": "portraits/grayson/m04_customs_intercept_03.png",
      "voice_file": "audio/m04_customs_intercept_grayson_03.mp3",
      "t": 39.688
    },
    {
      "cmd": "camera_path",
      "dur": 4.3,
      "ease": "linear",
      "keys": [
        {
          "pos": [
            0.0,
            4200.0,
            -8500.0
          ],
          "look_at": "ship:grayson_ship"
        }
      ],
      "t": 44.32,
      "follow": "paradigm_lead,broadsword_port,broadsword_center,broadsword_starboard"
    },
    {
      "cmd": "sfx",
      "file": "../sfx/laser_fire.wav",
      "pos": [
        -80667.0,
        31000.0,
        72000.0
      ],
      "t": 44.52
    },
    {
      "cmd": "sfx",
      "file": "../sfx/laser_fire.wav",
      "pos": [
        -66667.0,
        25000.0,
        71500.0
      ],
      "t": 44.87
    },
    {
      "cmd": "sfx",
      "file": "../sfx/laser_fire.wav",
      "pos": [
        -52667.0,
        31000.0,
        72000.0
      ],
      "t": 45.22
    },
    {
      "cmd": "sfx",
      "file": "../sfx/impact_shield.wav",
      "pos": [
        -66667.0,
        33333.0,
        64667.0
      ],
      "t": 45.62
    },
    {
      "cmd": "fade_out",
      "dur": 1.2,
      "t": 47.42
    },
    {
      "cmd": "end",
      "actions": [
        "set_flag:m04_customs_intercept_seen"
      ],
      "t": 48.62
    }
  ]
}
