{
  "id": "flyby_demo",
  "letterbox": true,
  "skippable": true,
  "timeline": [
    {
      "cmd": "fade_in",
      "dur": 2.0,
      "t": 0.0
    },
    {
      "cmd": "music",
      "file": "audio/flyby_theme.wav",
      "t": 0.0
    },
    {
      "cmd": "camera_path",
      "dur": 8.0,
      "ease": "smooth",
      "keys": [
        {
          "pos": [
            0.0,
            400.0,
            6000.0
          ],
          "look_at": [
            0.0,
            0.0,
            0.0
          ]
        },
        {
          "pos": [
            2500.0,
            150.0,
            3000.0
          ]
        },
        {
          "pos": [
            3200.0,
            -100.0,
            400.0
          ],
          "look_at": [
            0.0,
            0.0,
            0.0
          ]
        }
      ],
      "t": 0.5
    },
    {
      "cmd": "camera_path",
      "dur": 5.0,
      "ease": "smooth",
      "keys": [
        {
          "pos": [
            3200.0,
            -100.0,
            400.0
          ],
          "look_at": [
            0.0,
            0.0,
            0.0
          ]
        },
        {
          "pos": [
            1200.0,
            300.0,
            -1800.0
          ],
          "look_at": [
            0.0,
            0.0,
            0.0
          ]
        },
        {
          "pos": [
            0.0,
            500.0,
            -3600.0
          ],
          "look_at": [
            0.0,
            0.0,
            0.0
          ]
        }
      ],
      "t": 9.0
    },
    {
      "cmd": "fade_out",
      "dur": 2.0,
      "t": 13.0
    },
    {
      "cmd": "end",
      "t": 15.0
    }
  ]
}
